{
  "commands": [
    {
      "completion": "directory",
      "description": "Report instruction-context efficiency.",
      "implementationTicket": "G09",
      "maximumOperands": 1,
      "minimumOperands": 0,
      "name": "efficiency",
      "options": [
        {
          "completion": "none",
          "description": "Show command help.",
          "names": [
            "-h",
            "--help"
          ],
          "valueName": null,
          "values": []
        },
        {
          "completion": "none",
          "description": "Select an exact client profile.",
          "names": [
            "--agent"
          ],
          "valueName": "profile",
          "values": [
            "claude-code",
            "codex-cli",
            "copilot-cli",
            "copilot-cloud-agent",
            "copilot-code-review",
            "copilot-vscode",
            "cursor-agent",
            "gemini-cli"
          ]
        },
        {
          "completion": "none",
          "description": "Select deterministic terminal or JSON output.",
          "names": [
            "--format"
          ],
          "valueName": "format",
          "values": [
            "terminal",
            "json"
          ]
        },
        {
          "completion": "directory",
          "description": "Compare against an independently resolved repository source.",
          "names": [
            "--compare"
          ],
          "valueName": "repository",
          "values": []
        },
        {
          "completion": "none",
          "description": "Render terminal output without ANSI color.",
          "names": [
            "--no-color"
          ],
          "valueName": null,
          "values": []
        },
        {
          "completion": "none",
          "description": "Set terminal width from 40 through 240 columns.",
          "names": [
            "--width"
          ],
          "valueName": "columns",
          "values": []
        }
      ],
      "usage": "efficiency [repository] [--agent <profile>] [--format terminal|json] [--compare <repository>] [--no-color] [--width <columns>]",
      "validFirstOperands": []
    },
    {
      "completion": "file",
      "description": "Explain effective instructions for a target path.",
      "implementationTicket": "I03",
      "maximumOperands": 1,
      "minimumOperands": 1,
      "name": "explain",
      "options": [
        {
          "completion": "none",
          "description": "Show command help.",
          "names": [
            "-h",
            "--help"
          ],
          "valueName": null,
          "values": []
        },
        {
          "completion": "none",
          "description": "Select an exact client profile.",
          "names": [
            "--agent"
          ],
          "valueName": "profile",
          "values": [
            "claude-code",
            "codex-cli",
            "copilot-cli",
            "copilot-cloud-agent",
            "copilot-code-review",
            "copilot-vscode",
            "cursor-agent",
            "gemini-cli"
          ]
        },
        {
          "completion": "file",
          "description": "Load a repository-contained resolution-event trace.",
          "names": [
            "--trace"
          ],
          "valueName": "file",
          "values": []
        },
        {
          "completion": "none",
          "description": "Select an exact surface for a multi-surface client profile.",
          "names": [
            "--surface"
          ],
          "valueName": "surface",
          "values": [
            "cursor-agent/cli",
            "cursor-agent/ide"
          ]
        },
        {
          "completion": "none",
          "description": "Select deterministic terminal or JSON output.",
          "names": [
            "--format"
          ],
          "valueName": "format",
          "values": [
            "terminal",
            "json"
          ]
        }
      ],
      "usage": "explain <target> [--agent <profile>] [--surface <surface>] [--trace <file>] [--format terminal|json]",
      "validFirstOperands": []
    },
    {
      "completion": "directory",
      "description": "Create a starter repository configuration.",
      "implementationTicket": "I03",
      "maximumOperands": 1,
      "minimumOperands": 0,
      "name": "init",
      "options": [
        {
          "completion": "none",
          "description": "Show command help.",
          "names": [
            "-h",
            "--help"
          ],
          "valueName": null,
          "values": []
        }
      ],
      "usage": "init [repository]",
      "validFirstOperands": []
    },
    {
      "completion": "directory",
      "description": "List discovered instruction surfaces.",
      "implementationTicket": "I03",
      "maximumOperands": 1,
      "minimumOperands": 0,
      "name": "list",
      "options": [
        {
          "completion": "none",
          "description": "Show command help.",
          "names": [
            "-h",
            "--help"
          ],
          "valueName": null,
          "values": []
        },
        {
          "completion": "none",
          "description": "Select deterministic terminal or JSON output.",
          "names": [
            "--format"
          ],
          "valueName": "format",
          "values": [
            "terminal",
            "json"
          ]
        }
      ],
      "usage": "list [repository] [--format terminal|json]",
      "validFirstOperands": []
    },
    {
      "completion": "none",
      "description": "List installed lint rules.",
      "implementationTicket": "I03",
      "maximumOperands": 0,
      "minimumOperands": 0,
      "name": "rules",
      "options": [
        {
          "completion": "none",
          "description": "Show command help.",
          "names": [
            "-h",
            "--help"
          ],
          "valueName": null,
          "values": []
        },
        {
          "completion": "none",
          "description": "Select deterministic terminal or JSON output.",
          "names": [
            "--format"
          ],
          "valueName": "format",
          "values": [
            "terminal",
            "json"
          ]
        }
      ],
      "usage": "rules [--format terminal|json]",
      "validFirstOperands": []
    },
    {
      "completion": "directory",
      "description": "Lint repository agent instruction files.",
      "implementationTicket": "I02",
      "maximumOperands": 1,
      "minimumOperands": 0,
      "name": "scan",
      "options": [
        {
          "completion": "none",
          "description": "Show command help.",
          "names": [
            "-h",
            "--help"
          ],
          "valueName": null,
          "values": []
        },
        {
          "completion": "none",
          "description": "Select stylish, JSON, or SARIF output.",
          "names": [
            "--format"
          ],
          "valueName": "format",
          "values": [
            "stylish",
            "json",
            "sarif"
          ]
        },
        {
          "completion": "none",
          "description": "Run only a registered rule; repeat to select more.",
          "names": [
            "--rule"
          ],
          "valueName": "rule",
          "values": []
        },
        {
          "completion": "none",
          "description": "Override one rule severity as ACLNNN=severity; repeatable.",
          "names": [
            "--severity"
          ],
          "valueName": "override",
          "values": []
        },
        {
          "completion": "none",
          "description": "Choose the diagnostic failure threshold.",
          "names": [
            "--fail-on"
          ],
          "valueName": "threshold",
          "values": [
            "error",
            "warning",
            "never"
          ]
        },
        {
          "completion": "none",
          "description": "Bound rule-family worker concurrency from 1 through 10.",
          "names": [
            "--maximum-concurrency"
          ],
          "valueName": "workers",
          "values": []
        },
        {
          "completion": "none",
          "description": "Select a client profile; repeat to select more.",
          "names": [
            "--profile"
          ],
          "valueName": "profile",
          "values": [
            "claude-code",
            "codex-cli",
            "copilot-cli",
            "copilot-cloud-agent",
            "copilot-code-review",
            "copilot-vscode",
            "cursor-agent",
            "gemini-cli"
          ]
        },
        {
          "completion": "none",
          "description": "Select a client surface; repeat to select more.",
          "names": [
            "--surface"
          ],
          "valueName": "surface",
          "values": [
            "claude-code/local-session",
            "codex-cli/local-cli-single-cwd",
            "copilot-cli/local-terminal",
            "copilot-cloud-agent/github-hosted",
            "copilot-code-review/github-hosted",
            "copilot-vscode/local-chat",
            "cursor-agent/cli",
            "cursor-agent/ide",
            "gemini-cli/local-terminal"
          ]
        },
        {
          "completion": "none",
          "description": "Select diagnostics changed from one explicit Git base reference.",
          "names": [
            "--changed"
          ],
          "valueName": null,
          "values": []
        },
        {
          "completion": "none",
          "description": "Resolve the exact Git base reference for --changed mode.",
          "names": [
            "--base"
          ],
          "valueName": "ref",
          "values": []
        },
        {
          "completion": "none",
          "description": "Preview selected mechanical fixes without writing.",
          "names": [